jennifer aniston | previously on friends.
ross| phoebe, forget it, okay? newark is - is like an hour away.    there's no way we're gonna make it in time.
phoebe| she's got her cell, you could call her.
ross| i am not doing this over the phone.
phoebe| you don't have any other choice! (she lets go of the steering wheel to get her cell-phone from her    purse. ross screams and reaches over in order to hold onto the wheel. cut to the plane. rachel is sitting in her seat when her cell-phone    rings.)
rachel| hello?
phoebe| rachel? oh, good. hey, by the way, did you just get on the    plane?
rachel| yeah.
phoebe|  for what it's worth, we would have caught her if we were at the right airport.
ross| yay.
phoebe|" uh, rach, hang on. (phoebe tries to give her phone to ross, but he won't take it. he    mouths ""no."")"
rachel| phoebe? is everything okay?
phoebe| uhm, actually no. no, you've... you have to get off the plane.
rachel| what? why?
phoebe| i have this feeling that something's wrong with it. something    is wrong with the left philange.
rachel| oh, honey, i'm sure there's nothing wrong with the plane. (the passenger in the seat next to rachel looks at her and seems a    little nervous.)
rachel| alright, look, i have to go. i love you, and i will call you    the minute i get to paris. 
passenger #1| uhm, what was that?
rachel| oh, that was just my crazy friend. she told me i should get    off the plane, because she had a feeling that there was something    wrong with the left philange.
passenger #1| okay, that doesn't sound good.
rachel| i wouldn't worry about it. she's always coming up with stuff    like this, and you know what? she's almost never right.
passenger #1| but she is sometimes.
rachel| well... (the passenger stands up and gets his suitcase from the overhead    compartment.)
rachel| wait, what are you doing?
passenger #1| well, i can't take this plane now.
air stewardess| excuse me, sir, where are you going?
passenger #1| i have to get off this plane, okay? her friend has a    feeling something's wrong with the left philange.
rachel| could i get some peanuts?
passenger #2| what's wrong with the plane?
air stewardess| there's nothing wrong with the plane.
passenger #1| yeah! the left philange!
air stewardess| there is no philange!
passenger #1| oh my god. this plane doesn't even have a philange!
passenger #2| i'm not flying on it!
air stewardess| ma'am, please sit down!
passenger #3| what's going on?
passenger #1| we're all getting off. there is no philange! 
rachel| this is ridiculous! i... 
rachel| yeah, okay.     
monica| alright. my job here is done.
chandler| that was... impressive.
joey| yeah, you didn't even use the tools for most of it!
monica| yeah, they were just slowing me down. alright, i have to get    back to the babies. i'll see you girls later. 
chandler| sorry about the table, man.
joey| yeah.
chandler| you gonna buy a new one?
joey| probably not. nah. i don't know how much i'm gonna wanna play    after you go.
chandler| well, at least we got these little guys out.
joey| yeah.
chandler| aww, we were worried about you! hm. i guess i better get    used to things crapping in my hand, huh?
joey| i'm gonna miss these little guys. it was nice having birds    around again.
chandler| hey, you know what? maybe we should keep them here with you.
joey| what?
chandler| yeah, i mean we've got a lot going on right now. and, plus,    here they'd have their own room.
joey| i could get a goose!
chandler| you know, i - i think you're set with the poultry.
joey| thanks man. did you hear that, you guys? you're gonna get to    stay here! and, and it's good, you know, 'cause, 'cause now you have a    reason to come visit.
chandler| i think there may be another reason. so, awkward hug or lame    cool guy handshake?
joey| uh, lame cool guy handshake, yeah. (they do the lame cool guy handshake. they look at each other, and  then they hug.)      
gate attendant #2| ma'am, i assure you, the plane is fine.
passenger #2| and you fixed the philange?
gate attendant #2| yes, the philange is fixed. as a matter of fact, we    put a whole lot of extra philanges onboard, just in case. 
ross| where is she?
phoebe| i don't see her.
ross| rachel! rachel green!
phoebe| there she is!
ross| rachel! rachel!
gate attendant #2| wow, excuse me, sir, do you have a boarding pass?
ross| no, no, i just have to talk to someone.
gate attendant #2| i'm sorry, you cannot go any further without a    boarding pass.
ross| no, no, no, but...
phoebe|  rachel!! 
rachel| oh my god... what.. what are you guys doing here?
phoebe| okay, you're on.
rachel| what? what? ross, you're scaring me. what's going on?
ross| okay, the thing is..
rachel| yeah?
ross| don't go.
rachel| what?
ross| please, please stay with me. i am so in love with you. please,    don't go.
rachel| oh my god.
ross| i know, i know. i shouldn't have waited 'till now to say it, but    i'm.. that was stupid, okay? i'm sorry, but i'm telling you now. i    love you. do not get on this plane.
gate attendant #2| miss? are you boarding the plane?
ross| hey, hey. i know you love me. i know you do.
gate attendant #2| miss?
rachel| i - i have to get on the plane.
ross| no, you don't.
rachel| yes, i do.
ross| no, you don't.
rachel| they're waiting for me, ross. i can't do this right now, i'm    sorry. i'm sorry.
ross| rachel?
rachel| i'm so sorry. 
ross| i really thought she'd stay.
phoebe| i'm sorry.     
monica| well, that's it. everything's packed.
chandler| wow, this is weird.
monica| i know.
joey| yeah. uh, does this mean there's nothing to eat?
monica| i put three lasagnas in your freezer.
joey| i love you! 
joey| hey!
phoebe| hey.
joey| so did you guys make it in time?
phoebe| yeah, yeah, he talked to her, but she got on the plane anyway.
chandler| where's ross?
phoebe| he went home. he didn't want to see anybody.   
rachel|  ross, hi. it's me. i just got back    on the plane. and i just feel awful. that is so not how i wanted    things to end with us. it's just that i wasn't expecting to see you,    and all of a sudden you're there and saying these things... and... and    now i'm just sitting here and thinking of all the stuff i should have    said, and i didn't. i mean, i didn't even get to tell you that i love    you too. because of course i do. i love you. i love you. i love you.    what am i doing? i love you! oh, i've gotta see you. i've gotta get    off this plane.
ross| oh my god!
rachel|  excuse me?
air stewardess|  miss? please, sit down!
rachel|  i'm sorry. i'm really sorry, but i    need to get off the plane, okay? i need to tell someone that i love    love them.
air stewardess|  miss, i can't let you off    the plane.
ross| let her off the plane!
air stewardess|  i am afraid you are gonna    have to take a seat.
rachel|  oh, please, miss, you don't    understand!
ross| try to understand!
rachel|  oh, come on, miss, isn't there any    way that you can just let me off... 
ross| no! no! oh my god. did she get off the plane? did she get off    the plane?
rachel| i got off the plane.
ross| you got off the plane. 
rachel| i do love you.
ross| i love you too, and i'm never letting you go again.
rachel| okay. 'cause this is where i wanna be, okay? no more messing    around. i don't wanna mess this up again.
ross| me neither, okay? we are - we're done being stupid.
rachel| okay. you and me, alright? this is it.
ross| this is it. unless we're on a break. 
ross| don't make jokes now.       holding the twins. joey and phoebe are sitting by the window, while    ross and rachel are standing together. the apartment is completely  
monica| okay, please be careful with that. it was my grandmother's. be    careful. 
monica| if that falls off the truck, it wouldn't be the worst thing. 
ross| wow.
rachel| i know. it seems smaller somehow.
joey| has it always been purple?
chandler|  look around, you guys. this was your first    home. and it was a happy place, filled with love and laughter. but    more important, because of rent control, it was a friggin' steal! 
phoebe| hey, do you realise that at one time or another we all lived    in this apartment?
monica| oh, yeah, that's true.
ross| uh, i haven't.
monica| wait a minute. what about that summer during college that you    lived with grandma, and you tried to make it as a dancer?
ross| do you realise we almost made it ten years without that coming    up?
monica| oh, honey, i forgot. i promised treeger that we'd leave our    keys.
chandler| oh, okay. (chandler and monica walk over to the kitchen-counter and leave their    keys. then the other four pick out their keys and leave them as well.)
phoebe| so, i guess this is it.
joey| yeah. i guess so.
monica|  this is harder than i thought it would be.
chandler| oh, it's gonna be okay. (chandler hugs her. monica hugs ross and rachel as chandler gets the stroller with the    twins.)
rachel|  do you guys have to go to the new house right away,    or do you have some time?
monica| we got some time.
rachel| okay, should we get some coffee?
