chandler| yeah!  if-if-if we did do this there would be a lot of pressure on me, y’know? because you’ve been waiting a very long time and i wouldn’t want to disappoint you.
monica| yeah but see i have nothing to compare it too. so even if you’re horrible, how would i know?
chandler| i do like that.
monica| it’s harder for me! i have those four other women to compete with!
chandler| well, if it helps there were only three. so it would just be for tonight, right?
monica| absolutely! it would just be one friend  helping out another friend. 
chandler| stop it! we’re doing this! let’s do it!
monica| noo!! okay!!
chandler| okay! 
monica| umm, do you have any uhh, moves?
chandler| i have some moves.
monica| i have no moves. (he moves in to kiss her and she laughs and backs away.) okay, whatcha doin’ there?!  oh y’know what? i’m sorry, this is just too weird.
chandler| yeah, let’s just forget it.
monica| what if i turn out the lights? 
chandler| okay! 
chandler| oh yeah.
monica| chandler?
chandler|  yeah?
monica| that’s the couch. commercial break 
chandler| oh my god!
monica| i know! i’ll tell you something, we are gonna do that again!
chandler| oh, okay!  
joey|  morning!
rachel|  oh right.
joey| yeah.
rachel|  oh god. oh i can’t believe joey tribbiani heard me throw up!
joey| well he actually saw you a little bit too.
rachel| noo! oh god we did—we didn’t, we didn’t uhh…
joey| no! no! no, not after seeing that.
rachel| god i’m just a horrible person.
joey| wh-why?
rachel| because i’m married. that’s right, i am a married woman! and i came to a tv star’s apartment to have an affair! uck!
joey|" that’s ridiculous! i’m not a ""star,"" just a regular famous actor."
rachel| yeah and i’m a horrible, horrible person.
joey| rachel, would you stop saying that?! hey-hey look, remember on the show when-when caprice was dying and she gave me…
rachel| the ring from the cave, yeah.
joey| wow! uh okay, well uh… (he gets up, opens a drawer, and pulls out the ring.)
rachel|  oh my god, they let you keep that stuff?!
joey| sure! as long as they don’t find out you can keep whatever you want! and i want you to have it.
rachel| no! no-no-no…
joey| yes! yes!! and every time you look at it, i want you to remember that you are a good person. okay, you’ve had the chance to cheat, and with me, but you didn’t. and that’s what this ring stands for.
rachel| but i thought that ring stood for caprice’s undying love for her brother.
joey| look, do you want the ring or not?!
rachel| yeah!  
ross| hey!
joey| hey!
ross| look at you! you’re up!
joey| all right!
phoebe| i thought i’d try to take a walk. would you pour me some water? i’ll be back soon.
joey| whoa-whoa-whoa! you’re not gonna use the pay phone to call work, are ya?
phoebe| no. i’ve learned my lesson. (she goes out into the hall and when she’s there and the door is closed; she rips off her robe to reveal her work clothes.)
phoebe| let’s go! come on! move it!  come on! (to an old man who’s holding her shoes and briefcase.) shoes! briefcase!  thanks lou, good luck with the gall bladder.  
ross| hey joe did… did you ever have a threesome?
joey|  well uh, look ross i uh, i think carol’s great and i’m sure you’re a very attractive man, but i….
ross| no! the reason i’m asking is that… i sorta had one last night.
joey| you?
ross| yeah!
joey| wow!
ross| yeah!
joey| all right! so, was it amazing?
ross| it was, it was okay.
joey| just okay—did you do it right?!
ross|" look, it’s just did, did you ever go to a party and think, ""would really anyone miss me if i weren’t here?"""
joey| huh. but still ross, you’re worst day with two women, pretty much better than any other day! y’know what i mean?
ross| oh-oh, absolutely! 
ross| it’s just, my part seemed to be over pretty quickly and then, and then there was a lot of waiting around.
joey| but you got to be with both of them, right?
ross| not-not really. th-th-there was just carol.
joey| not the other one?
ross| no, she kept kicking me away!
joey| yeah, you don’t want that.
ross| no!
joey| well hey, at least you got to see a lot of stuff, right?
ross| oh i a lot of stuff!
joey| you got a little bored?
ross| a little. yeah. i made a snack.
joey| yeah? what did ya have?
ross| just a sandwich. turkey, a little mustard…
joey| sounds good.
ross| it really was! 
chandler| hey!
monica| hey!
chandler| let me tell you about this chick i scored with last night! oh no wait a minute that was you!
monica| hey, check me out, i’m a slut!
chandler| so you uh, want to do something tonight?
monica| oh i can’t. dr. roger is coming over again.
chandler| oh. oh right! right! because you’re still seeing him and uh, he’s a good guy. i mean, i remember a time when… 
monica| are you okay?
chandler| yeah! totally! totally, and you?
monica|" great! it’s so amazing! i mean, last time dr. roger came over, i was so nervous, but then after being with you i’m all like, ""can the doctor see me now?"""
chandler| i bet he can.
monica| y’know, i don’t have an appointment, but i sure could use a physical.  are you sure you’re okay?
chandler| oh yeah! yeah! don’t worry about me, i’ll be fine! (does a kara-tay move.)  
rachel| ohh! my god! barry!!
barry| you-you-you said you were gonna be away all weekend!
rachel| oh that’s right! i’m sorry! i-i am early! finish! please!!  
phoebe| surprise! look who’s back! 
arthur| hey pheebs! 
phoebe| hey!  
arthur|  pheebs, didn’t you get fired?
phoebe| uh, i don’t think so!
jack| phoebe?
phoebe| jack!! hey!
jack| what are you doing here?
phoebe| all better! back to work! except this clown from research told me i was fired. he should do his research, huh?
jack| well, you were fired.
phoebe| nu-uh!
jack| i told that guy who answered your phone.
phoebe| oh, okay i didn’t get that message. so this doesn’t count—anyway, i’ll be in my office.
jack| uh, phoebe you-you don’t have an office.
phoebe| that’s all right, i’ll work here. this is goo, next to this plant. 
jack|  phoebe, listen…
phoebe| you’re in my office! look, i have made a lot of cash for this company! okay? i am talking big bucks! pesos! yen! rubles! you make one little mistake…
jack| you lost 13 million dollars.
phoebe| oh, so this is all about money! y’know it’s bad enough that—ow! oh, you have got to be kidding!
jack| are you all right?
phoebe| i’m having another heart attack!
jack| what?!
phoebe| i’m having another heart attack!! call 9-1-1!!
jack| take it easy. 
phoebe|  dumbass!
woman| hey pheebs! how’s it going?!
phoebe| well, they fired me and i’m having heart attack.
woman| wow! well, welcome back!
phoebe| yeah. 
rachel| hi ross!
ross| hey rachel.
rachel| is joey tribbiani here?
ross| umm, no.
rachel| well, if you see him, will you please tell him that i’m looking for him and that this i am not gonna throw up!
ross| that-that’s always good news. are you okay?
rachel| me? i’m great! i’m fine! i’m sooo good!! but, you know who’s not great?! men! you’re a man right ross?!
ross| yeah.
rachel| sit down! 
ross| okay.  
rachel| let me uh, let me ask you something, do wedding vows mean squat to you people?! and why is it that the second we tell you we’re going out of town, bamn there you are in bed with the neighbor’s dog walker?!
ross| we’re sorry.
rachel| no seriously! seriously! what has happened to the sanctity of marriage?
ross| didn’t you spend last night at joey’s?
rachel| aw what are you?! a detective?
ross| look i-i don’t know what’s going on with you and your husband and what is hopefully an adult dog walker, look can i just say not all men are like that.
rachel| oh. 
ross| hey! there are some men who will do whatever it takes to make their marriage work! okay? there are some men who will stand by and-and watch as their wives engage in-in what only can be described as a twosome with some-some woman she barely knows from the gym!
rachel| who are these men?
ross| men. i guy i know.
rachel| well, you might want to tell him it sounds like his wife is  gay.
ross| she is not…  she’s gay. oh my god. she is so gay! i can’t believe this.
rachel| good day for married people huh?
ross| i’m sorry your husband cheated on you.
rachel| i’m sorry your wife is gay. i guess women aren’t that great either.
ross| try telling my wife that. 
chandler|  okay to come in?
monica| yeah, come on, eat, whatever you want. dr. roger got beeped again.
chandler| yeah i know, guess who beeped him?
monica| what?!
chandler| i’m the ruptured spleen.  
monica| why would you do that?
chandler| because you shouldn’t be with him.  you should be with me.
monica| really?
chandler| yeah! when you were talking about roger, that was killing me! look, things like last night they don’t just happen. y’know? or at least not to me. or with the other two women, in the morning y’know i was just lying there and i couldn’t wait to just go hang out with my friends, but with you i always y’know with a friend.
monica| chandler!
chandler|" i know you probably don’t want to go out with me, y’know because i make too many jokes and i’ve never been in a serious relationship and i guess i’m not technically a ""doctor…"" "
monica| there was just one woman, wasn’t there?
chandler| no, there were two.
monica| including me?
chandler| oh yeah. ending credits 
